<?xml version="1.0" encoding="UTF-8"?>

<!--
    Document   : MobSchema.xsd
    Created on : November 7, 2007, 2:37 PM
    Author     : Oliviu Ghica, Northwestern Unviersity
    Description: Specifies the XML-namespace for Moving Objects in SIDnet
        Purpose of XML Schema document follows.
-->

<xsd:schema xmlns:xsd="http://www.w3.org/2001/XMLSchema"
            elementFormDefault="qualified">
  
<xsd:element name="mob">
 <xsd:complexType>
  <xsd:sequence>   
   <xsd:element name="mobProfileName" type="xsd:string"/>
   
   <xsd:element name="fieldDimensions">
       <xsd:complexType>
           <xsd:sequence>
               <xsd:element name="length" type="xsd:integer"/>
               <xsd:element name="width" type="xsd:integer"/>    
           </xsd:sequence>
       </xsd:complexType>
   </xsd:element>
    
   <xsd:element name="radiance" type="xsd:integer"/>
   
   <xsd:element name="timeUnit">
       <xsd:simpleType>
           <xsd:restriction base="xsd:string">
               <xsd:enumeration value="milisecond"/>
               <xsd:enumeration value="second"/>
               <xsd:enumeration value="minute"/>
               <xsd:enumeration value="hour"/>
           </xsd:restriction>
       </xsd:simpleType>
   </xsd:element>
   
   <xsd:element name="periodicity" type="xsd:integer"/> <!-- Specify 0 for infinite loops-->

   <xsd:element name="path">
        <xsd:complexType>
            <xsd:sequence>
                <xsd:element name="locationInTime" maxOccurs="100">
                    <xsd:complexType>
                        <xsd:sequence>
                            <xsd:element name="timeStamp" type="xsd:long"/>
                            <xsd:element name="xCoord" type="xsd:integer"/>
                            <xsd:element name="yCoord" type="xsd:integer"/>
                        </xsd:sequence>
                    </xsd:complexType>
                </xsd:element>
            </xsd:sequence>
        </xsd:complexType>
    </xsd:element>

     </xsd:sequence>
    </xsd:complexType>
  </xsd:element>  
</xsd:schema>
